{
  "$schema": "https://json-schema.org/draft/2020-12/schema",
  "$id": "https://opentikz.org/meta.schema.json",
  "title": "OpenTikZ item metadata",
  "description": "Schema for every <name>.meta.json sibling of an icon, template, or example. See docs/DESIGN_GUIDE.md.",
  "type": "object",
  "additionalProperties": false,
  "required": [
    "id",
    "name",
    "type",
    "domain",
    "tags",
    "author",
    "license",
    "requires",
    "preview"
  ],
  "properties": {
    "id": {
      "type": "string",
      "description": "Globally unique, stable identifier (kebab-case). Used by catalog.json and the website.",
      "pattern": "^[a-z0-9]+(?:-[a-z0-9]+)*$",
      "minLength": 1
    },
    "name": {
      "type": "string",
      "description": "Human-readable display name.",
      "minLength": 1
    },
    "type": {
      "type": "string",
      "description": "Which content layer this item belongs to.",
      "enum": ["icon", "template", "example", "skill"]
    },
    "domain": {
      "type": "array",
      "description": "Browse-grouping categories (e.g. systems, ml, pipeline).",
      "items": { "type": "string", "minLength": 1 },
      "minItems": 1,
      "uniqueItems": true
    },
    "tags": {
      "type": "array",
      "description": "Free-form search keywords.",
      "items": { "type": "string", "minLength": 1 },
      "uniqueItems": true
    },
    "venue": {
      "type": "array",
      "description": "Optional: conference/venue widths this item is tuned for (e.g. CVPR, NeurIPS, ACL).",
      "items": { "type": "string", "minLength": 1 },
      "uniqueItems": true
    },
    "author": {
      "type": "string",
      "description": "Contributor name or handle.",
      "minLength": 1
    },
    "license": {
      "type": "string",
      "description": "SPDX identifier. Graphic content is CC0-1.0.",
      "minLength": 1
    },
    "requires": {
      "type": "array",
      "description": "LaTeX packages / TikZ libraries the .tex needs in its preamble.",
      "items": { "type": "string", "minLength": 1 },
      "uniqueItems": true
    },
    "preview": {
      "type": "string",
      "description": "Relative path to the generated .svg preview.",
      "minLength": 1
    },
    "description": {
      "type": "string",
      "description": "Optional one-line description of the item."
    },
    "featured": {
      "type": "boolean",
      "description": "Optional: include this item on the marketing Home showcase."
    },
    "composed_of": {
      "type": "array",
      "description": "Optional: ids of the library items this figure is composed of (powers the decomposable showcase / deep-links).",
      "items": { "type": "string", "minLength": 1 },
      "uniqueItems": true
    },
    "edit_contract": {
      "type": "object",
      "description": "Optional (templates only): the machine-readable edit contract the using-opentikz skill consumes. validate.py cross-checks that every parameters[].name and styles[] entry actually appears in the sibling .tex.",
      "additionalProperties": false,
      "required": ["parameters", "node_naming", "styles", "operations", "invariants"],
      "properties": {
        "parameters": {
          "type": "array",
          "description": "The \\def macros at the top of the .tex that drive the figure.",
          "items": {
            "type": "object",
            "additionalProperties": false,
            "required": ["name", "meaning"],
            "properties": {
              "name": { "type": "string", "description": "The macro, including backslash, e.g. \\layersizes.", "minLength": 1 },
              "type": { "type": "string", "description": "Informal value type, e.g. list<int>, length-cm, text.", "minLength": 1 },
              "meaning": { "type": "string", "description": "What the parameter controls.", "minLength": 1 },
              "default": { "type": "string", "description": "The value shipped in the template.", "minLength": 1 },
              "invariant": { "type": "string", "description": "A constraint the value must satisfy.", "minLength": 1 }
            }
          },
          "minItems": 1
        },
        "node_naming": {
          "type": "string",
          "description": "The node-naming scheme skills target, e.g. 'L<layer>-<neuron>, 1-based'.",
          "minLength": 1
        },
        "styles": {
          "type": "array",
          "description": "The tikz style names (each appears as <style>/.style= in the .tex).",
          "items": { "type": "string", "minLength": 1 },
          "minItems": 1,
          "uniqueItems": true
        },
        "operations": {
          "type": "array",
          "description": "Safe, contract-sanctioned edit operations (prose; not machine-checked).",
          "items": {
            "type": "object",
            "additionalProperties": false,
            "required": ["id", "summary"],
            "properties": {
              "id": { "type": "string", "pattern": "^[a-z0-9]+(?:-[a-z0-9]+)*$", "minLength": 1 },
              "summary": { "type": "string", "minLength": 1 }
            }
          },
          "minItems": 1
        },
        "invariants": {
          "type": "array",
          "description": "Rules an edit must never break (prose; not machine-checked).",
          "items": { "type": "string", "minLength": 1 },
          "minItems": 1,
          "uniqueItems": true
        }
      }
    },
    "selfcheck": {
      "type": "object",
      "description": "Optional: explicit, reviewable opt-outs from the D6 visual-self-check gate's mechanical checks (docs/VISUAL_SELFCHECK.md). A committed, reviewable waiver -- never a runtime agent decision.",
      "additionalProperties": false,
      "required": ["allow_diagonal_edges_reason"],
      "properties": {
        "allow_diagonal_edges": {
          "type": "boolean",
          "description": "Exempt this template from the mechanical non-orthogonal-edge check (contract §3a typed-routing). Only meaningful for ESL-family templates (domain includes esl-architecture), which are the only ones this check runs against."
        },
        "allow_diagonal_edges_reason": {
          "type": "string",
          "description": "Why a diagonal edge is intentional here (required whenever allow_diagonal_edges is true).",
          "minLength": 1
        }
      }
    }
  }
}
