{
  "id": "esl-architecture-block",
  "name": "ESL MPSoC tile / bus architecture block",
  "type": "template",
  "domain": ["systems", "esl-architecture"],
  "tags": ["mpsoc", "architecture", "block diagram", "tile", "core", "accelerator", "noc", "bus", "digital"],
  "venue": ["DAC", "ICCAD", "DATE", "ESWEEK"],
  "author": "cp-4856 PoC graft (grounded in tsarilp-pub doc/common/tikzsetup.tex, not a fork of that file)",
  "license": "CC0-1.0",
  "requires": ["xcolor", "tikz", "calc", "shapes", "positioning", "backgrounds", "fit", "patterns", "arrows.meta"],
  "preview": "preview.svg",
  "description": "MPSoC-style tile/bus architecture figure: per-tile Core + Accelerator + config-register block joined by an intra-tile bus, two tiles joined by a dashed inter-tile NoC bus through a shared I/O terminal node. Colors are the ESL domain-semantic tokens (contract §2, ADR-0005 D7): core-accent=core/compute (Aquamarine), process-accent=datapath/accelerator (NavyBlue), param-accent=config/parameters (ForestGreen), intra-bus=Orange, inter-bus=NavyBlue, digitaldomain=terminal/IO (gray) -- extending opentikz's five-color ot* palette, not remapped onto it (see reference/color-palettes/color-palettes.md and cp-4856 learnings note on the palette-invariant collision).",
  "edit_contract": {
    "parameters": [
      {"name": "\\tilesep", "type": "length-cm", "meaning": "horizontal gap between the two tile boundary boxes", "default": "2.6"},
      {"name": "\\coresize", "type": "length-pt", "meaning": "core box minimum height", "default": "50pt"},
      {"name": "\\corewidth", "type": "length-pt", "meaning": "core box minimum width", "default": "64pt"},
      {"name": "\\tileonelabel", "type": "text", "meaning": "tile 0 boundary label"},
      {"name": "\\tiletwolabel", "type": "text", "meaning": "tile 1 boundary label"},
      {"name": "\\coreonelabel", "type": "text", "meaning": "tile 0 core label"},
      {"name": "\\coretwolabel", "type": "text", "meaning": "tile 1 core label"},
      {"name": "\\acconelabel", "type": "text", "meaning": "tile 0 accelerator label"},
      {"name": "\\acctwolabel", "type": "text", "meaning": "tile 1 accelerator label"},
      {"name": "\\cfgonelabel", "type": "text", "meaning": "tile 0 config-register block label (use \\\\ for two lines)"},
      {"name": "\\cfgtwolabel", "type": "text", "meaning": "tile 1 config-register block label (use \\\\ for two lines)"},
      {"name": "\\iolabel", "type": "text", "meaning": "shared I/O terminal node label"},
      {"name": "\\interbuslabel", "type": "text", "meaning": "inter-tile bus caption above the I/O node"}
    ],
    "node_naming": "cpu-core: (core1, core2); acc-core: (acc1, acc2); param-node: (cfg1, cfg2); tile: (tile1, tile2)",
    "styles": ["PE", "core", "process", "parameters", "terminal node", "intrabus", "interbus", "fit margins"],
    "operations": [
      {"id": "rename-component", "summary": "edit the matching label macro"},
      {"id": "add-tile-component", "summary": "declare a node inside the tile with a role style (core/process/parameters), position it relative to an existing tile-local node, connect it with intrabus, then add it to that tile's fit=(...) list so the boundary re-encloses it"},
      {"id": "add-tile", "summary": "duplicate a tile's node block with a fresh index (3, 4, ...), position its fit node right=\\tilesep cm of the previous tile, wire the shared io node to the new tile's fit.north, and extend the coordinate used for the interbus caption if more than two tiles are joined at the io hub"},
      {"id": "change-component-role", "summary": "swap a node's style to change its role: core<->process<->parameters; each role keeps its own dedicated palette color per the domain-semantic scheme, so a role change also changes the color, never just the shape"},
      {"id": "add-bus", "summary": "intra-tile: \\draw[intrabus] (a) -- (b); inter-tile/NoC: \\draw[interbus] (tileN.<anchor>) -- (io);"},
      {"id": "resize-tile-boundary", "summary": "adjust the tile's fit margins={left=...,right=...,top=...,bottom=...} values (grafted tikzsetup.tex pgfkeys helper) or extend which nodes are in its fit=(...) list"},
      {"id": "recolor-role", "summary": "change the domain-semantic color for a whole role by re-binding that role's palette token (e.g. \\colorlet{core-accent}{...}), never by editing the role's style to a raw color; keep intrabus=intra-bus, interbus=inter-bus-dashed, core=core-accent, process=process-accent, parameters=param-accent unless the family's settled-decisions record says otherwise (see cp-4856 note: this template has no settled-decisions record of its own yet — it is a PoC graft, not the shipped Phase-1 component library)"}
    ],
    "invariants": [
      "a template must not name a semantic component the contract's §1 vocabulary does not define (§1 extensibility rule)",
      "style/color bindings carry their contract §2 token role; a role's color is never swapped for decoration",
      "(seam: no WP-7 family settled-decisions record yet for family 'architecture'; family-specific placement/style/semantic invariants project here once it lands)"
    ]
  }
}
