{
  "id": "esl-crossbar-kcl",
  "name": "ESL analog crossbar cell + KCL summation node",
  "type": "template",
  "domain": ["circuits", "esl-architecture"],
  "tags": ["circuit-schematic", "circuitikz", "crossbar", "analog", "kcl", "current-mode", "in-memory-compute", "weight-cell"],
  "venue": ["ISSCC", "VLSI Symposium", "TCAS-I", "JSSC"],
  "author": "cp-4856 PoC graft (grounded in analog-ai EmbML-HB-2026-Ch-AnalogEDAI/fig/figstyle.tex, not a fork of that file)",
  "license": "CC0-1.0",
  "requires": ["tikz", "circuitikz", "amsmath", "arrows.meta", "backgrounds", "positioning", "calc"],
  "preview": "preview.svg",
  "description": "Analog in-memory-compute crossbar readout: 2x2 weight-cell array driven by row voltage sources, per-column KCL summation (Sigma) nodes, and a real circuitikz device-symbol readout stage (sense resistor / reference current source) per column. First circuitikz-based template in this local checkout -- opentikz ships zero circuitikz coverage upstream. Colors are the ESL domain-semantic tokens (contract §2, ADR-0005 D7): inputdomain=input/activation (blue), weightdomain=analog weight cell (green), analogdomain=analog current/summation (orange) -- extending opentikz's five-color ot* palette, not remapped onto it (see reference/color-palettes/color-palettes.md and cp-4856 learnings note on the palette-invariant collision).",
  "edit_contract": {
    "parameters": [
      {"name": "\\rowgap", "type": "length-cm", "meaning": "vertical gap between input rows", "default": "1.1"},
      {"name": "\\colgap", "type": "length-cm", "meaning": "horizontal gap between columns", "default": "1.6"},
      {"name": "\\vinonelabel", "type": "text", "meaning": "row 1 voltage-source label"},
      {"name": "\\vintwolabel", "type": "text", "meaning": "row 2 voltage-source label"},
      {"name": "\\kcllabel", "type": "text", "meaning": "KCL summation-node glyph (shared across columns)"},
      {"name": "\\outcollabel", "type": "text", "meaning": "final output-current label"}
    ],
    "node_naming": "v-source: (vin-1, vin-2); crossbar-cell: (cell-1-1, cell-2-1, cell-1-2, cell-2-2); kcl-node: (kcl-1, kcl-2)",
    "styles": ["kclnode", "cell", "vsource", "sidenote", "domainlbl", "currentlbl", "voltagelbl", "awire", "dwire", "vwire"],
    "operations": [
      {"id": "rename-label", "summary": "edit the matching label macro, or the literal $G_{i,j}$/$I_{i,j}$ text in a cell/current-label node (kept literal, not macro-driven, to preserve the family's comma-separated two-index subscript convention -- see invariants)"},
      {"id": "add-row", "summary": "add \\node[vsource] (vin-3) at (0,-2*\\rowgap) {...}; add a \\node[cell] (cell-3-<c>) per existing column at the same x as cell-1-<c>/cell-2-<c>, y=-2*\\rowgap; wire \\draw[vwire] (vin-3) -- (cell-3-<c>); and \\draw[awire] (cell-3-<c>) -- (kcl-<c>); for every column -- node identifiers stay dash-separated vin-<row>/cell-<row>-<col>/kcl-<col> (cp-4883 family-wide naming ruling, C8), never concatenated-digit"},
      {"id": "add-column", "summary": "add a \\node[cell] (cell-<r>-3) per existing row at x=3*\\colgap; wire \\draw[vwire] (vin-<r>) -- (cell-<r>-3); add a \\node[kclnode] (kcl-3) below the new column; wire every \\draw[awire] (cell-<r>-3) -- (kcl-3); and its readout branch (see add-readout-device) -- node identifiers stay dash-separated cell-<row>-<col>/kcl-<col> (cp-4883 family-wide naming ruling, C8), never concatenated-digit"},
      {"id": "add-readout-device", "summary": "declare \\coordinate (dev-<c>) at ($(kcl-<c>)+(0,-1.8)$); then \\draw (kcl-<c>) to[<device>, l=$<label>$, o-o, name=<id>] (dev-<c>); -- <device> is a real circuitikz bipole key (R, I, C, L, ...), NOT a figstyle node style; this is the one place this template mixes circuitikz bipoles with hand-styled tikzset nodes. name=<id> is required (settled-decisions/circuit-schematic.yaml circuitikz-bipole-node-identity; enforced by tools/adapter/checks.py) -- a short, lowercase, unique-per-figure identifier that gives the bipole PGF node identity so detect_node_node_collisions can see it. -1.8 is the minimum offset verified collision-free by rendering to PNG (WP-5 fix for the original -1.15, which visually overlapped the KCL node) -- never shrink it back without re-verifying from a render"},
      {"id": "recolor-role", "summary": "change the domain-semantic color for a whole role by re-binding that role's palette token (e.g. \\colorlet{inputdomain}{...}), never by editing the role's style to a raw color; keep vsource=inputdomain, cell=weightdomain, kclnode/awire/currentlbl=analogdomain, per the analog-ai family's settled scheme, unless a project's own settled-decisions record overrides it (this template ships no settled-decisions record of its own -- it is a PoC graft, not the shipped Phase-1 component library, see D4/R2.3 of ADR-0004)"}
    ],
    "invariants": [
      "a template must not name a semantic component the contract's §1 vocabulary does not define (§1 extensibility rule)",
      "style/color bindings carry their contract §2 token role; a role's color is never swapped for decoration",
      "substructure-recognition: recognize known analog SUBSTRUCTURES (current mirror, differential pair, cascode) as the placement UNIT and place them as a block, not transistor-by-transistor; the VMM crossbar-array is this family's concrete ESL substructure. Place blocks first, refine within.",
      "symmetry-axis: matched/paired devices (a differential pair, mirrored current sources, a symmetric crossbar) are placed SYMMETRICALLY across a shared axis (usually vertical).",
      "device-orientation: device ORIENTATION (rotation/flip) is part of placement, not just position — orient devices so pins face their connection and mirror matched devices about the symmetry axis.",
      "power-ground-rails: the power/supply rail is PINNED at the top and the ground rail PINNED at the bottom; rails are placed/connected FIRST (VDD, GND net priority before signal nets).",
      "signal-flow-direction: signal flows LEFT->RIGHT — primary inputs enter at the left, outputs exit at the right; place stages along that axis.",
      "rows-are-inputs: crossbar-cell rows run HORIZONTAL; each row is one activation/input line driven from a v-source at the row's left end (rows left->right, row index increases downward).",
      "cols-are-weights: crossbar-cell columns run VERTICAL; a column is a weight-cell stack sharing one bitline (column index increases left->right). Use crossbar-array for the grid.",
      "current-sums-downward: per-column current flows DOWNWARD and accumulates; each column wire below cell (r,c) carries the running sum I_{1,c}+..+I_{r,c} (label it on the segment).",
      "kcl-at-column-foot: each column terminates in exactly one kcl-node at the column FOOT (below the last cell), tagged \"KCL\"; the column current sums into it.",
      "adc-below-kcl: the adc sits BELOW the kcl-node row (analog current in from the top apex-side, digital word out the far side); never above or beside the summation.",
      "analog-digital-split: the analog/digital split is carried by a domain-band + one dashed domain-boundary; the digital region sits BELOW/AFTER the ADC, the analog accumulation above it.",
      "body-font: Fonts match the chapter body — newtx Times text + math.",
      "show-dont-tell: No equation/annotation callout boxes in the figure; equations live in \\caption.",
      "domain-labels-inside-bands: Domain labels sit INSIDE the shaded bands (small italic, top corner).",
      "comma-subscripts: Two-index subscripts are comma-separated, row then column — G_{i,j}, I_{1,j}.",
      "concrete-indices: Arrays use concrete indices (G_{2,2}), no generic highlighted exemplar cell.",
      "typed-wires: Wire color encodes domain — orange=analog current (awire), gray=digital word (dwire), blue=input voltage (vwire) — the token->role binding is reserved and never swapped across the analog/digital or voltage/current domain boundary (e.g. awire never carries a v-source-to-cell edge, vwire never carries a cell-to-KCL edge). Stealth arrowheads everywhere.",
      "circuitikz-bipole-reservation: circuitikz `to[...]` bipoles are reserved for real EE devices (resistor, current/voltage source, capacitor, etc.); crossbar cells, KCL nodes, and voltage-source glyphs stay the hand-styled figstyle-derived node styles (cell/kclnode/vsource) — never redraw a cell as a circuitikz bipole, and never redraw a real device as a plain hand-styled node. Mixing the two idioms in one figure is intentional and must stay legible (label each readout branch).",
      "circuitikz-bipole-node-identity: every circuitikz `to[...]` bipole carries `name=<id>` (a short, lowercase, dash-free identifier unique within the figure, e.g. `name=rsense`) -- in addition to, never instead of, the bipole-reservation idiom above.",
      "kcl-current-label-clearance: every KCL node has a labeled incoming-current annotation (currentlbl) placed clear of neighboring columns.",
      "palette-additive-not-remapped: the ESL domain-semantic tokens (inputdomain/weightdomain/digitaldomain/ analogdomain) are ADDITIVE to opentikz's five ot* names — never remapped onto or aliased through otblue/otorange/otteal/otpurple/otgray.",
      "kcl-not-sigma-glyph: Column sum is a KCL node (joined lines + a small \"KCL\" tag), not a bare Sigma.",
      "xw-is-digital-logic: x_i . w_{i,j} is a digital multiply (XNOR for +-1, AND for 0/1); the product gates a per-cell current source labeled DAC — signal is analog ONLY after the DAC.",
      "running-column-sums: Column wires carry running sums — below (1,1) is I_{1,1}; below (2,1) is I_{1,1}+I_{2,1}; the KCL yields I_j.",
      "adcbuffer-is-zoomin: adcbuffer is the zoom-in of the Sigma+ADC stage of mixed-signal-mac; keep aligned."
    ]
  }
}
