{
  "id": "esl-mpsoc-tile-array",
  "name": "ESL MPSoC tile/PE array (parametric \\foreach generator)",
  "type": "template",
  "domain": ["systems", "esl-architecture"],
  "tags": ["mpsoc", "architecture", "tile array", "pe array", "noc", "mesh", "digital", "foreach", "generator", "array-scale"],
  "venue": ["DAC", "ICCAD", "DATE", "ESWEEK"],
  "author": "cp-4892 (WP-4, ADR-0005 D5) -- extends the esl-architecture-block PoC (cp-4856) with a \\foreach-driven array generator",
  "license": "CC0-1.0",
  "requires": ["xcolor", "tikz", "calc", "backgrounds", "fit", "arrows.meta"],
  "preview": "preview.svg",
  "description": "Parametric MPSoC tile grid (\\ntilerows x \\ntilecols) with a PE sub-grid (\\pegridrows x \\pegridcols) contained inside each tile, generated by nested \\foreach loops rather than hand-listed nodes. Node names stay index-addressable (tile-<r>-<c>, pe-<r>-<c>-<k>) at any scale. Proven at 32+ tiles with legibility handled via pelabelmode (blank PE fill above a few tiles) and an O(tiles) inter-tile mesh (not O(tiles^2)). The tile corner-label sits in dedicated fit-box headroom (never on a contained PE) and the intra-tile bus is an orthogonal row/column lattice (never diagonal), per coordinator review. Colors reuse the esl-architecture-block domain-semantic scheme (Aquamarine=PE/core-accent, Orange=intra-bus, NavyBlue dashed=inter-bus).",
  "edit_contract": {
    "parameters": [
      {"name": "\\ntilerows", "type": "int", "meaning": "number of tile rows in the MPSoC grid", "default": "2"},
      {"name": "\\ntilecols", "type": "int", "meaning": "number of tile columns in the MPSoC grid", "default": "2"},
      {"name": "\\pegridrows", "type": "int", "meaning": "PE sub-grid row count inside each tile", "default": "2"},
      {"name": "\\pegridcols", "type": "int", "meaning": "PE sub-grid column count inside each tile", "default": "2"},
      {"name": "\\tilelabelprefix", "type": "text", "meaning": "tile label prefix; rendered as \"<prefix><row>.<col>\"", "default": "T"},
      {"name": "\\pelabelmode", "type": "enum(index,none)", "meaning": "PE-node text label: \"index\" prints the PE's flat 1-based index, \"none\" leaves it blank -- the legibility control for large arrays", "default": "index"},
      {"name": "\\tilegapx", "type": "length-cm", "meaning": "horizontal gap between tile boundary boxes", "default": "0.9"},
      {"name": "\\tilegapy", "type": "length-cm", "meaning": "vertical gap between tile boundary boxes; must clear the fit box's own top/bottom margins (~0.7cm together, see invariants) or a tile's corner label crowds the tile above it", "default": "1.3"},
      {"name": "\\pegap", "type": "length-cm", "meaning": "gap between PEs within a tile", "default": "0.15"},
      {"name": "\\pesize", "type": "length-cm", "meaning": "PE node minimum size", "default": "0.5"},
      {"name": "\\showmesh", "type": "bool(0,1)", "meaning": "1 draws the inter-tile NoC mesh (right/below neighbor only, O(tiles)); 0 omits it entirely", "default": "1"}
    ],
    "node_naming": "tile: tile-<row>-<col> (generated, index-addressable); pe: pe-<row>-<col>-<k> (generated, index-addressable)",
    "styles": ["pe", "tilebox", "tilelabel", "intrabus", "interbus", "fit margins"],
    "operations": [
      {"id": "resize-grid", "summary": "edit \\ntilerows/\\ntilecols (tile count) and/or \\pegridrows/\\pegridcols (PEs per tile) -- the generator re-derives every node name and position; no coordinate ever needs hand-editing"},
      {"id": "toggle-pe-labels", "summary": "set \\pelabelmode to \"none\" once the grid is large enough that per-PE index text would collide (see invariants); the PE's identity is still its node name, not its printed text"},
      {"id": "toggle-mesh", "summary": "set \\showmesh to 0 to omit the inter-tile NoC mesh entirely (e.g. when only containment/tile-array structure matters, not interconnect)"},
      {"id": "resize-spacing", "summary": "\\pesize/\\pegap for PE sizing and intra-tile density; \\tilegapx/\\tilegapy for inter-tile density"},
      {"id": "recolor-role", "summary": "change the domain-semantic color for a whole role by editing that role's \\colorlet binding at the top of the file (core-accent/intra-bus/inter-bus) -- never a raw color name inline in a style; keep the esl-architecture-block assignments (core-accent=Aquamarine, intra-bus=Orange, inter-bus=NavyBlue) unless a family settled-decisions record overrides it"}
    ],
    "invariants": [
      "a template must not name a semantic component the contract's §1 vocabulary does not define (§1 extensibility rule)",
      "style/color bindings carry their contract §2 token role; a role's color is never swapped for decoration",
      "hierarchy-is-organizer: explicit HIERARCHY/containment is the organizing primitive — tile ⊃ (pe | cpu-core | acc-core | mem-block); state the nesting explicitly so it is checkable and transfers to a nested-graph backend (ELK subgraphs, draw.io containers).",
      "tiles-on-a-grid: tile containers are laid out on a regular grid (rows x columns), uniform size and gap; the grid is anchored once and every other tile placed relationally off it.",
      "pes-inside-tiles: pe (and cpu-core / acc-core) nodes sit INSIDE their tile via the tile's fit/opts; a PE never floats outside the tile it belongs to.",
      "tile-fit-declared-after-members: a tile's boundary fit node is declared AFTER every node it fits, inside an `on background layer` scope, so the tile box renders behind its members rather than occluding them.",
      "ports-on-boundaries: buses attach at PORTS pinned on the tile/block BOUNDARY at the connection point; an inter-bus/NoC edge attaches to a tile's boundary port, never to a PE interior, and routes orthogonally from there.",
      "intra-bus-stays-in-tile: intra-bus edges are SHORT and orthogonal, connecting PEs/mem within ONE tile only; they never cross a tile boundary.",
      "noc-spine-between-tiles: the NoC / inter-bus is routed ORTHOGONALLY along the gaps between tile edges (a spine/mesh between tiles), connecting tile boundary ports, not PE interiors.",
      "shared-memory-locus: shared-memory (mem-block) sits at ONE consistent locus across the set (e.g. a central spine or a fixed edge), the same place in every figure of the family.",
      "legend-corner-groupbox: the legend is a group-box in a fixed corner, outside the tile grid; it never overlaps tiles or the NoC spine.",
      "bus-color-split: intra-bus = Orange, inter-bus/NoC = NavyBlue (contract §2 tokens); consistent.",
      "bus-dash-split: the inter-tile bus is ALWAYS dashed and the intra-tile bus is ALWAYS solid — this distinction is load-bearing (NoC/global vs. local/tile-internal traffic), independent of and in addition to the color split above.",
      "core-accents: cpu-core = Aquamarine fill, acc-core = ForestGreen fill; PEs a light green.",
      "palette-additive-not-remapped: the ESL domain-semantic tokens (core-accent/process-accent/param-accent/ intra-bus/inter-bus) are ADDITIVE to opentikz's five ot* names — never remapped onto or aliased through otblue/otorange/otteal/otpurple/otgray.",
      "containment-is-membership: a node drawn inside a tile IS a member of that tile; no purely decorative nesting."
    ]
  }
}
